{
  "experience": "使用者按下刪除後，需要確認這個不可逆的操作。",
  "visual": "畫面中央出現一個醒目的確認視窗，背景變暗，主要的刪除動作使用警示色。",
  "interaction": "使用者可以選擇刪除或取消，也可以關閉視窗。完成或取消後回到原本的畫面。",
  "states": [
    {
      "name": "loading",
      "visual": "刪除動作進行時顯示進度，避免使用者再次按下刪除。",
      "interaction": "完成前不能重複送出或關閉造成不一致。"
    },
    {
      "name": "failure",
      "visual": "在視窗內清楚顯示操作失敗，保留重新嘗試的方式。",
      "interaction": "使用者可以重新嘗試或取消，原本的內容仍然保留。"
    }
  ],
  "references": ["產品刪除流程設計稿", "現有確認視窗截圖"]
}
